,Unnamed: 0,Article_id,Venue,Title,Year,Abstract,Doi,fieldsOfStudy,topics,Downloadurl,TotalCitationCount,Influentialcitationcount
19,19,https://doi.org/10.1055/s-0039-1681088,Methods of information in medicine,leverag electron dental record data classifi patient base smoke intens,2018,background smoke establish risk factor oral diseas therefor dental clinician routin assess record patient detail smoke status research success extract smoke histori electron health record ehr use text mine method howev could retriev patient smoke intens due limit avail ehr presenc detail smoke inform electron dental record edr often separ section allow retriev inform less preprocess object determin patient detail smoke status base smoke intens edr method first author creat refer standard 3296 uniqu patient smoke histori edr classifi patient base smoke intens next train three machin learn classifi support vector machin random forest naïv bay use train set 2176 evalu perform test set 1120 use precis p recal r fmeasur f final appli best classifi classifi smoke status addit 3114 patient smoke histori result support vector machin perform best classifi patient smoker nonsmok unknown p r f 98 intermitt smoker p 95 r 98 f 96 past smoker p r f 89 light smoker p r f 87 smoker unknown intens p 76 r 86 f 81 intermedi smoker p 90 r 88 f 89 perform moder differenti heavi smoker p 90 r 44 f 60 edr could valuabl sourc obtain patient detail smoke inform conclus edr data could serv valuabl sourc obtain patient detail smoke inform base smoke intens may readili avail ehr,10.1055/s-0039-1681088,Medicine,Patients,https://dl.acm.org/doi/pdf/10.1055/s-0039-1681088?download=true,5,0
20,20,https://doi.org/10.1136/bmjopen-2016-012528,BMJ Open,link medic dental health record data partnership rochest epidemiolog project,2017,purpos purpos project expand rochest epidemiolog project rep medic record linkag infrastructur includ data oral healthcar provid goal linkag facilit research studi examin role oral health overal health qualiti life particip eight dental practic join rep 2011 2015 rep studi team link oral healthcar inform medic record inform local healthcar provid 31 750 particip resid olmst counti minnesota overal 17 718 56 particip women 14 318 45 40 year age older 26 090 82 white find date first studi use new inform recent complet resourc use determin whether 2007 guidelin american heart associ affect prescript rate antibiot patient moderaterisk cardiac condit prior dental procedur rep infrastructur use identifi seri patient diagnos moderaterisk cardiac condit local healthcar provid n1351 abstract antibiot prescript dental record pre2007 post2007 antibiot prescript prior dental procedur declin 62 7 follow chang guidelin futur plan dental data particip practition updat annual basi new dental data link patient medic record addit continu invit new dental practic particip rep final continu use research infrastructur investig associ oral medic health present find confer scientif literatur,10.1136/bmjopen-2016-012528,Medicine,"Dental Records,Deciduous tooth,Edrophonium,Tooth root structure,Structure of permanent tooth,Behavior,General Practice, Dental,Odontogenic Tissue,Insurance, Dental,Supernumerary,Pulp Canals,Forty Nine,Posterior Pituitary Hormones,Silo (dataset),Sodium monofluorophosphate 0.0076 MG/MG Toothpaste,Document completion status - Documented,Patients",https://dl.acm.org/doi/pdf/10.1136/bmjopen-2016-012528?download=true,10,0
21,21,https://doi.org/10.1111/eje.12203,European journal of dental education : official journal of the Association for Dental Education in Europe,inform retriev critic apprais knowledg evidence‐bas dentistri among finnish dental student,2017,background one core skill compet dentist abil search analys highqual evid problem understand basic aspect knowledgebas inform may imped implement clinic practic examin finnish dental student acquir scientif inform familiar method evalu scientif evid relat clinic question method fifthyear dental student n 120 three univers finland receiv selfadminist questionnair result three common use sourc inform colleagu commerci health gate portal dental practition person lectur note although student rare read scientif journal find possess least passabl even good skill literatur retriev three question relat apprais evid dentistri reveal student knowledg evidencebas dentistri inadequ critic evalu clinic research find conclus student seem lack knowledg key methodolog evidencebas term present curricula dental school fail encourag student search acquir knowledg wider patient univers respons teach dentist various method critic apprais cope scientif inform,10.1111/eje.12203,Medicine,,https://dl.acm.org/doi/pdf/10.1111/eje.12203?download=true,10,0
22,22,https://doi.org/10.1016/j.ijmedinf.2017.08.007,Int. J. Medical Informatics,perceiv critic success factor electron health record system implement dental clinic context organis manag perspect,2017,background electron health record ehr make health care effici improv qualiti care make patient medic histori access howev littl known factor contribut success ehr implement dental clinic object articl aim identifi perceiv critic success factor ehr system implement dental clinic context method use ground theori analys data collect context brunei nation ehr healthcar inform manag system bruhim data analysi follow stage open axial select code result six perceiv critic success factor emerg usabl system emerg behaviour requir analysi train chang manag project organis studi identifi mismatch endus product ownervendor perspect discuss workflow chang signific challeng clinician confid use particular system offer limit modular configur recommend made parti involv healthcar inform system implement manag chang process agre system goal function wider consensu debat particip support strategi realis common commit,10.1016/j.ijmedinf.2017.08.007,Medicine Computer Science,Precipitating Factors,https://dl.acm.org/doi/pdf/10.1016/j.ijmedinf.2017.08.007?download=true,26,0
23,23,https://doi.org/10.1016/j.adaj.2017.01.026,Journal of the American Dental Association,medic care provid perspect dental inform need electron health record,2017,background author conduct studi identifi relev patient dental inform medicaldent integr electron health record iehr necessari medic care provid inform holist treatment method author collect input divers sampl 65 particip larg region health system repres 13 medic specialti administr unit author collect feedback particip 11 focus group session two independ review analyz focus group transcript identifi major minor theme result author identifi 336 385 annot medic care provid code relev annot strong support relev clinic practic align 18 major themat categori top 6 categori communic appoint system design medic treatment plan dental alert conclus studi particip identifi dental data highest relev medic care provid recommend implement userfriend access dental data iehr crucial holist care deliveri practic implic identif patient dental inform relev medic care provid inform strategi improv integr inform medicaldent iehr,10.1016/j.adaj.2017.01.026,Medicine,Electronic Health Records,https://dl.acm.org/doi/pdf/10.1016/j.adaj.2017.01.026?download=true,18,0
24,24,https://doi.org/10.3121/cmr.2017.1380,Clinical Medicine & Research,updat electron dental record clinic comput adopt among dental practic unit state,2017,studi sought recharacter trend factor affect electron dental record edr technolog adopt dental practic impact health inform technolog econom clinic health hitech act adopt rate 2012 39question survey dissemin nation 3 month use novel statisticallymodel approach inform earli respons rate achiev predetermin sampl edr adopt rate clinic support 52 adopt rate higher among 1 younger dentist 2 dentist ≤ 15 year practic 3 femal 4 group practic top barrier adopt edr costexpens costbenefit ratio electron format convers poor edr usabl awar feder hitech incent program low rate chairsid comput implement 72 adopt edr dental offic unit state higher 2012 electron health record adopt rate medic offic driven hitech program patient portal adopt among dental practic unit state remain low,10.3121/cmr.2017.1380,Medicine,Pain,https://dl.acm.org/doi/pdf/10.3121/cmr.2017.1380?download=true,14,0
25,25,https://doi.org/10.1016/j.adaj.2017.04.017,Journal of the American Dental Association,evalu qualiti dental care among patient diabet adapt test dental qualiti measur electron health record,2017,background patient diabet increas risk develop oral complic annual dental examin endors prevent strategi author evalu feasibl valid implement autom electron health record ehrbas dental qualiti measur determin whether patient diabet receiv evalu method author select dental qualiti allianc measur develop claim data adapt specif ehr autom queri identifi patient diabet across 4 dental institut author manual review subsampl chart evalu queri perform assess initi ehr measur author defin test revis ehr measur captur better oral care receiv patient diabet result initi revis measur author use ehr autom queri identifi 12960 13221 patient diabet respect report year variat measur score across site greater initi measur rang 364713 revis measur rang 788881 autom queri perform well 93 higher sensit specif posit negat predict valu measur conclus result suggest autom ehrbas queri use success measur qualiti oral health care deliv patient diabet author also found use rich data avail ehr may help estim qualiti care better reli claim data practic implic detail clinic patientlevel data dental ehr may use dentist evalu qualiti dental care provid patient diabet,10.1016/j.adaj.2017.04.017,Medicine,soft tissue,https://dl.acm.org/doi/pdf/10.1016/j.adaj.2017.04.017?download=true,14,0
26,26,https://doi.org/10.1016/j.adaj.2016.06.005,Journal of the American Dental Association,data scienc nation institut dental craniofaci research chang dental practic,2016,none,10.1016/j.adaj.2016.06.005,Medicine,Classification,https://dl.acm.org/doi/pdf/10.1016/j.adaj.2016.06.005?download=true,4,0
27,27,https://doi.org/10.4338/ACI-2015-09-LE-0124,Appl. Clin. Inform.,ehr teeth,2016,correspond elsbeth kalenderian dds mph phd chair oral health polici epidemiolog chief qualiti harvard dental center harvard school dental medicin 188 longwood avenu reb 206 boston 02115 telephon 617–432–1455 mobil 617–947–7645 appl clin inform 2016 7 425–429 httpdxdoiorg104338aci201509le0124 receiv octob 9 2015 accept march 6 2016 publish may 25 2016 citat kalenderian e halamka jd spallek h ehr teeth appl clin inform 2016 7 425–429 httpdxdoiorg104338aci201509le0124 letter editor,10.4338/ACI-2015-09-LE-0124,Computer Science Medicine,Adverse event,https://dl.acm.org/doi/pdf/10.4338/ACI-2015-09-LE-0124?download=true,11,0
28,28,https://doi.org/10.4338/ACI-2015-11-RA-0150,Appl. Clin. Inform.,explor dental provid workflow electron dental record environ,2016,background workflow defin predefin set work step partial order step environ achiev expect outcom studi investig workflow provid dental offic import understand interact dental provid exist technolog point care assess breakdown workflow could contribut better technolog design object studi object assess electron dental record edr workflow use time motion methodolog order identifi breakdown opportun process improv method time motion methodolog use studi humancomput interact workflow dental provid edr four dental center larg healthcar organ data collect tool develop captur workflow dental provid staff interact edr initi plan emerg patient visit front desk qualit quantit analysi conduct observ data result breakdown workflow identifi post charg view radiograph eprescrib interact patient schedul edr interact time signific differ dentist dental assist 620 min vs 1057 min p 0013 dentist dental hygienist 620 min vs 936 min p 0003 conclus averag dentist spent far less time dental assist dental hygienist data record within edr,10.4338/ACI-2015-11-RA-0150,Computer Science Medicine,Traumatic injury,https://dl.acm.org/doi/pdf/10.4338/ACI-2015-11-RA-0150?download=true,3,0
29,29,https://doi.org/10.1016/j.jebdp.2016.07.001,The journal of evidence-based dental practice,clinic document dental care era electron health record use,2016,background although complet accur clinic record guarante provis excel dental care provid opportun evalu qualiti care provid howev lack univers accept document standard incomplet recordkeep practic unfriend electron health care record ehr user interfac factor allow persist poor dental patient record keep method use 2 differ methodsa valid survey 2round delphi processinvolv 2 appropri differ set particip explor dental clinic record contain frequenc updat clinic entri result closedend survey question openend delphi process question respond signific degre agreement clinic entri compon adequ clinic record howev varianc frequent clinic entri updat summari dental provid agre complet accur record keep essenti item histori examin find diagnosi radiograph treatment plan consent clinic note document howev seem univers agreement frequent item record clinic implic dental profess move toward preval use electron health care record issu standard interoper becom ever press settl issu standard includ record document must begin guidelinecr dental profession bodi need clear defin dissemin standard everyday dentist ultim ensur standard met kept,10.1016/j.jebdp.2016.07.001,Medicine,common types,https://dl.acm.org/doi/pdf/10.1016/j.jebdp.2016.07.001?download=true,7,0
30,30,https://doi.org/10.1016/j.adaj.2015.06.023,Journal of the American Dental Association,measur up implement dental qualiti measur electron health record context,2016,background qualiti improv requir use qualiti measur implement valid manner use guidelin set forth meaning use portion health inform technolog econom clinic health act author assess feasibl perform autom electron meaning use dental clinic qualiti measur determin percentag children receiv fluorid varnish method author defin implement autom measur queri dental electron health record within record identifi autom queri author manual review subsampl assess perform queri result autom queri result reveal 710 patient fluorid varnish compar manual chart review result indic 776 patient fluorid varnish autom qualiti measur perform result indic 905 sensit 908 specif 969 posit predict valu 752 negat predict valu conclus author find support feasibl use autom dental qualiti measur queri context suffici structur data inform note free text rather structur data would requir use natur languag process approach effect queri electron health record practic implic particip selfdirect qualiti improv dental clinician must embrac account era commit qualiti requir enhanc document support nearterm autom calcul qualiti measur,10.1016/j.adaj.2015.06.023,Medicine,Dental Procedures,https://dl.acm.org/doi/pdf/10.1016/j.adaj.2015.06.023?download=true,20,1
31,31,https://doi.org/10.7860/JCDR/2016/16970.7453,Journal of clinical and diagnostic research : JCDR,dental informat india time embrac chang,2016,dental informat compar juvenil new field noteworthi potenti support clinic care research educ manag field util comput scienc inform scienc applic espous dentistri howev underdevelop develop countri almost dentist unacquaint dental informat goal capabl achiev mean get involv despit emerg advanc certain conflict also go along profession represent secur issu store inform due univers access comput high speed internet connect endnot softwar use resourc materi collect literatur care arrang synchron way henc purpos review give overal scenario dental informat applic challeng recommend enhanc area,10.7860/JCDR/2016/16970.7453,Computer Science Medicine,Positive Predictive Value of Diagnostic Test,https://dl.acm.org/doi/pdf/10.7860/JCDR/2016/16970.7453?download=true,6,2
32,32,https://doi.org/10.1007/978-3-319-17272-9_9,,appli hci principl design usabl system dentistri,2015,dentistri medicin demand practic team perform technic procedur dynam environ thrust electron world centuri reli upon paper document communic unlik medicin though dentistri abil document communic hamper lack adequ avail diagnost terminolog intern classif diseas icd long part parcel medic practic dentist access standard term describ procedur document gap thrown stark relief era electron health record structur data direct use secondari analysi chapter describ applic hci principl effort bring newli develop dental diagnost terminolog dental clinic implement dental ehr adequ budget time access broad spectrum commit stakehold includ ehr vendor practic dentist epidemiologist informatician abl follow iter participatori design approach refin terminolog interfac terminolog leaner approach heurist evalu alon would appropri access wealth resourc though scalingback would cours impact abil identifi address usabl challeng high collabor work undertaken effort enhanc profess dentistri narrow gap use secondari user data usabl perspect primari user,10.1007/978-3-319-17272-9_9,Computer Science,Patients,https://dl.acm.org/doi/pdf/10.1007/978-3-319-17272-9_9?download=true,1,0
33,33,https://doi.org/10.1016/J.JDS.2014.07.003,,develop dental informat dental inform technolog china systemat studi,2015,abstract backgroundpurpos dental informat di new emerg interdisciplin medic informat mi general dentistri dental inform technolog dit parallel research field purpos studi investig current situat di dit china evalu achiev analyz weak anticip futur develop materi method public di dit english chines journal intern chines research search literatur review fund support di dit china manual search di dit educ china analyz websit search telephon interview result investig indic china start research di dit field late 1970s develop becom rapid last 10 year chines intern public increas sharpli within last decad chines govern kept stabl increas invest di dit scientif project chines research made influenti achiev certain field di dit computeraid design computeraid manufactur cadcam develop applic computerassist manufactur facial prosthesi threedimension 3dassist dental educ conclus di dit develop rapid china recent year howev problem remain resolv,10.1016/J.JDS.2014.07.003,Medicine,Chart evaluation by healthcare professional,https://dl.acm.org/doi/pdf/10.1016/J.JDS.2014.07.003?download=true,2,0
34,34,https://doi.org/10.1016/j.adaj.2015.06.023,Journal of the American Dental Association,measur up implement dental qualiti measur electron health record context,2016,background qualiti improv requir use qualiti measur implement valid manner use guidelin set forth meaning use portion health inform technolog econom clinic health act author assess feasibl perform autom electron meaning use dental clinic qualiti measur determin percentag children receiv fluorid varnish method author defin implement autom measur queri dental electron health record within record identifi autom queri author manual review subsampl assess perform queri result autom queri result reveal 710 patient fluorid varnish compar manual chart review result indic 776 patient fluorid varnish autom qualiti measur perform result indic 905 sensit 908 specif 969 posit predict valu 752 negat predict valu conclus author find support feasibl use autom dental qualiti measur queri context suffici structur data inform note free text rather structur data would requir use natur languag process approach effect queri electron health record practic implic particip selfdirect qualiti improv dental clinician must embrac account era commit qualiti requir enhanc document support nearterm autom calcul qualiti measur,10.1016/j.adaj.2015.06.023,Medicine,Contain (action),https://dl.acm.org/doi/pdf/10.1016/j.adaj.2015.06.023?download=true,20,1
35,35,https://doi.org/10.1016/j.jebdp.2013.12.002,The journal of evidence-based dental practice,modifi approach dental code benefit person profession develop improv clinic outcom,2014,background one disadvantag remark achiev dentistri treatment option never vari confus made concept evidenc base dentistri applic modern dental practic despit merit concept wherebi clinic decis guid scientif evid problem establish scientif base challeng modern dentistri gap rapid develop productsprocedur evid base widen furthermor burden oral diseas continu remain high popul level problem prompt new approach enhanc research aim aim paper outlin modifi approach dental code may benefit clinic popul level research method materi use public assess data obtain australian chronic diseas dental scheme item code contain within australian schedul dental servic glossari suggest approach dental informat illustr result select item code select expand addit suffix suffix provid circumstanti inform assist assess clinic outcom success rate prognosi conclus use item code administ cdds yield larg databas item code code amen dental informat shown enhanc research clinic popul level cost effect method supplement exist research method,10.1016/j.jebdp.2013.12.002,Medicine,Charts (publication),https://dl.acm.org/doi/pdf/10.1016/j.jebdp.2013.12.002?download=true,1,0
36,36,https://doi.org/10.1136/amiajnl-2013-002230,AMIA,bigmouth multiinstitut dental data repositori,2014,oral health databas avail research advanc evidencebas dentistri work develop central data repositori deriv electron health record ehr four dental school particip consortium oral health research informat multistakehold committe develop data govern framework encourag data share allow control contribut data adopt i2b2 data wareh platform map data institut common refer terminolog realiz dental ehr urgent need adopt common terminolog use treatment code set three four site use common diagnost terminolog wide discrep medic dental histori document bigmouth success launch august 2012 data 11 million patient made avail user contribut institut,10.1136/amiajnl-2013-002230,Computer Science Medicine,Abducens Nerve Diseases,https://dl.acm.org/doi/pdf/10.1136/amiajnl-2013-002230?download=true,35,3
37,37,https://doi.org/10.2196/jmir.3343,Journal of medical Internet research,explor design requir repurpos dental virtual patient web second life focus group studi,2014,background sinc incept virtual patient provid health care educ way engag learner experi simul clinician environ without danger learner patient led learn modal accept essenti compon medic educ advent visual audiorich 3dimension multius virtual environ muve new deploy platform emerg educ content immers high interact multimediarich muve seamless foster collabor provid new hotb deploy medic educ content object work aim assess suitabl second life muve virtual patient deploy platform undergradu dental educ explor requir specif need meaning repurpos webbas virtual patient muve method script capabl avail art asset second life repurpos exist webbas periodontolog virtual patient second life seri pointandclick interact multiplechoic queri user experienc specif periodontolog case ask provid optim respons challeng case focus group 9 undergradu dentistri student experienc webbas second life version virtual patient group conven 3 time discuss relev issu group comput literaci assess second life virtual patient deploy platform compar webbas muvedeploy virtual patient result comparison webbas second life virtual patient reveal inher advantag experienti immers second life virtual environ howev sever challeng success repurpos virtual patient web muve identifi identifi challeng repurpos web virtual patient muve platform focus group studi 1 increas case complex facilit user game preconcept muve 2 necess decreas textual narrat provid pertin inform immers sensori way 3 requir allow user actuat solut problem instead describ narrat conclus success systemat repurpos effort virtual patient muve second life best practic experienti immers game design organ incorpor repurpos workflow autom find pivot era open educ content transfer share among user learner educ various open repositoriesenviron,10.2196/jmir.3343,Medicine,"Precipitating Factors,Electronic Health Records,Pain,soft tissue,Classification,Adverse event,Traumatic injury,common types,Dental Procedures,Positive Predictive Value of Diagnostic Test,Patients,Chart evaluation by healthcare professional,Contain (action),Charts (publication),Abducens Nerve Diseases",https://dl.acm.org/doi/pdf/10.2196/jmir.3343?download=true,46,0
38,38,https://doi.org/10.4103/1357-6283.152194,Education for health,awar attitud student one indian dental school toward inform technolog use improv patient care,2014,background mani obstacl need overcom digit electron technolog fulli integr oper dental clinic countri obstacl may physic technic psychosoci barrier form percept attitud relat softwar incompat patient privaci interfer patientpractition relationship object studi assess percept indian dental student one school toward use digit technolog improv dental practic willing use digit electron technolog perceiv obstacl use digit electron technolog dental care setup attitud toward internet privaci issu method studi popul consist 186 final year undergradu dental student b shetti memori institut dental scienc rajiv gandhi univers health scienc mangalor india survey data analyz descript result student indic inform technolog enhanc patient satisfact qualiti dental record diagnosi treatment plan doctordoctor communic cost equip need technic train regard major obstacl substanti proport respond discuss dental student school feel inform technolog support decis make diagnos devis effect treatment plan turn increas patient satisfact qualiti care student also perceiv lack technic knowledg high cost implement major barrier develop inform technolog india,10.4103/1357-6283.152194,Medicine,,https://dl.acm.org/doi/pdf/10.4103/1357-6283.152194?download=true,6,0
